{
  "schema_version": "vfxspec.v1",
  "effect_family": "slash",
  "effect_type": "slash_arc",
  "prompt": "stylized top-down slash core arc with clear attack direction",
  "negative_prompt": "closed ring, symmetric UI icon, rectangular billboard, reused V9 arc",
  "generation": {
    "run_id": "slash_arc_pref_001_r001",
    "candidate_id": "slash_arc_pref_001_r001_c0040",
    "seed": 20649774,
    "generator": "slash_arc_generator",
    "generator_version": "0.1.0",
    "parent_candidate_id": null
  },
  "adapter": {
    "name": "slash.adapter",
    "version": "0.1.0",
    "schema_ref": "schemas/adapters/slash_adapter.schema.json",
    "generator_family": "curve_mesh",
    "topology": {
      "arc_topology": "broken_sweep",
      "attack_direction": "left_to_right",
      "control_point_count": 5,
      "asymmetry": 0.7488
    },
    "shape": {
      "arc_length": 6.4745,
      "arc_width": 0.682,
      "width_profile": "tapered",
      "tip_shape": "forked",
      "curvature": -0.4516,
      "edge_breakup": 0.0045,
      "residual_flow": "outward",
      "control_points": [
        [
          -3.2365,
          0.0,
          0.3103
        ],
        [
          -1.781,
          0.0,
          -0.5573
        ],
        [
          0.057,
          0.0,
          -0.8695
        ],
        [
          1.4904,
          0.0,
          -0.4662
        ],
        [
          3.5841,
          0.0,
          0.0011
        ]
      ],
      "width_samples": [
        [
          0.0,
          0.9019
        ],
        [
          0.18,
          0.8121
        ],
        [
          0.38,
          0.661
        ],
        [
          0.58,
          0.4465
        ],
        [
          0.78,
          0.2536
        ],
        [
          1.0,
          0.015
        ]
      ]
    },
    "evaluation_metrics": [
      "sharpness",
      "attack_direction",
      "width_profile",
      "tip_quality",
      "silhouette_readability"
    ]
  },
  "layers": [
    {
      "role": "core_blade",
      "status": "active",
      "topology": "curve_mesh",
      "shape_parameters": {
        "arc_length": 6.4745,
        "arc_width": 0.682,
        "width_profile": "tapered",
        "tip_shape": "forked",
        "curvature": -0.4516,
        "edge_breakup": 0.0045,
        "residual_flow": "outward",
        "control_points": [
          [
            -3.2365,
            0.0,
            0.3103
          ],
          [
            -1.781,
            0.0,
            -0.5573
          ],
          [
            0.057,
            0.0,
            -0.8695
          ],
          [
            1.4904,
            0.0,
            -0.4662
          ],
          [
            3.5841,
            0.0,
            0.0011
          ]
        ],
        "width_samples": [
          [
            0.0,
            0.9019
          ],
          [
            0.18,
            0.8121
          ],
          [
            0.38,
            0.661
          ],
          [
            0.58,
            0.4465
          ],
          [
            0.78,
            0.2536
          ],
          [
            1.0,
            0.015
          ]
        ]
      },
      "material_parameters": {
        "base_color": "cold_white",
        "alpha_power": 1.0105,
        "edge_emission": 0.9755,
        "dissolve_bias": 0.3242
      },
      "timing_parameters": {
        "appear_time": 0.2723,
        "peak_time": 0.5943,
        "fade_time": 0.849
      },
      "constraints": [
        "core_blade_only",
        "no_support_arc",
        "no_hit_accent",
        "no_scene_anchor"
      ]
    }
  ],
  "render_plan": {
    "unity_project": "E:/UnityVFX/EffectDemo6.0",
    "scene": "Assets/Scenes/SampleScene.unity",
    "camera": "VFXCaptureCamera",
    "resolution": "1280x720",
    "time_points_seconds": [
      0.3,
      0.5,
      0.6,
      0.75,
      0.9
    ]
  }
}
